; format hex
; comment line
; address: byte0,byte1,byte2.
;0x0: 0x1,0x2,0x3,0x4. ; hex
; 0: 1,2,3,4.
; format hex
; comment line
; address: byte0,byte1,byte2.
;0x0: 0x1,0x2,0x3,0x4. ; hex
; 0: 1,2,3,4.
0x0: 0x14, 0x1E, 0x84, 0x80, 0x00, 0x15, 0x00, 0x41, 0x00, 0x00, 0x00, 0x00, 0x00, 0x00, 0x0, 0x0.
;0x005: 0x05.
0x10: 0xA4, 0x1F, 0xBC, 0x34, 0x78, 0x69.
0x60: 0x01, 0x21, 0x02, 0x00, 0x2B, 0x00, 0x00, 0x80, 0x00, 0x01, 0x06.
0x80: 0x0B, 0xFF, 0x38.
0x90: 0x01.
0x92: 0x03.
0x93: 0x21.
0x96: 0x2b.
0x97: 0x04.
0x98: 0x01.
0x99: 0x1f.
0x9a: 0x0e.
0x9b: 0x08.
0x9e: 0x00.
0x100: 0x00.
0x101: 0x00.
0x120: 0x00.
0x160: 0x00.
0x200: 0x01.
0x202: 0x77, 0x77, 0x81.
0x280: 0x1.
0x600: 0x02.
0x700: 0x04.
0x2205: 0x05.
0x3035: 0x03.
0x3036: 0x09.
0x305A: 0x29.
0x303B: 0x01.


