0x00000: 0x14, 0x0A, 0xC4, 0x41, 0x00, 0x10, 0x01, 0xC0, 0x02, 0x00, 0x00, 0x00, 0x1F, 0x0B, 0x80, 0x00.
0x00010: 0xA4, 0x1F, 0x30, 0x2A, 0x76, 0x2F, 0xBC, 0x34, 0x00, 0x00, 0x00, 0x00, 0x00, 0x00, 0x00, 0x00.
0x00020: 0x00, 0x00, 0x00, 0x00, 0x00, 0x00, 0x00, 0x00, 0x00, 0x00, 0x00, 0x00, 0x00, 0x00, 0x01, 0x01.
0x00060: 0x00, 0x00, 0x00, 0x00, 0x00, 0x00, 0x00, 0x00, 0x00, 0x00, 0x00, 0x00, 0x00, 0x00, 0x00, 0x00.
0x00070: 0x03, 0x39, 0x00, 0x00, 0x04, 0x00, 0x00, 0x00, 0x00, 0x00, 0x00, 0x00, 0x00, 0x00, 0x00, 0x00.
0x00090: 0x00, 0x00, 0x00, 0x00, 0x00, 0x00, 0x00, 0x00, 0x00, 0x00, 0x00, 0x00, 0x00, 0x00, 0x00, 0x00.
0x00100: 0x0A, 0x84, 0x00, 0x01, 0x01, 0x01, 0x01, 0x80, 0x01, 0x10, 0x00, 0x00, 0x00, 0x00, 0x00, 0x00.
0x00110: 0x00, 0x00, 0x00, 0x00, 0x00, 0x02, 0x03, 0x00, 0x00, 0x00, 0x00, 0x00, 0x00, 0x00, 0x00, 0x00.
0x00160: 0x00, 0x00, 0x00, 0x00, 0x00, 0x00, 0x00, 0x00, 0x00, 0x00, 0x00, 0x00, 0x00, 0x00, 0x00, 0x00.
0x00170: 0x65, 0x00, 0x00, 0x00, 0x00, 0x00, 0x00, 0x00, 0x00, 0x00, 0x00, 0x00, 0x00, 0x00, 0x00, 0x00.
0x00200: 0x01, 0x00, 0x00, 0x00, 0x00, 0x01, 0x11, 0x11, 0x00, 0x00, 0x00, 0x00, 0x03, 0x00, 0x00, 0x00.
0x00210: 0x00, 0x00, 0x00, 0x00, 0x00, 0x00, 0x00, 0x80, 0x00, 0x0A, 0x00, 0x00, 0x00, 0x00, 0x00, 0x00.
0x00220: 0x04, 0x00, 0x00, 0x00, 0x00, 0x00, 0x00, 0x00, 0x00, 0x00, 0x00, 0x00, 0x00, 0x00, 0x00, 0x00.
0x00230: 0x00, 0x00, 0x00, 0x00, 0x00, 0x00, 0x00, 0x00, 0x00, 0x00, 0x00, 0x00, 0x00, 0x00, 0x00, 0x00.
0x00240: 0xE1, 0x49, 0x35, 0x2C, 0xEA, 0x4D, 0x20, 0x00, 0x00, 0x00, 0x01, 0x00, 0x00, 0x00, 0x00, 0x00.
0x00310: 0x00, 0x00, 0x00, 0x00, 0x38, 0x00, 0x04, 0x00, 0x00, 0x00, 0x00, 0x00, 0x00, 0x00, 0x00, 0x00.
0x00320: 0x01, 0x00, 0x00, 0x00, 0x00, 0x00, 0x00, 0x00, 0x00, 0x00, 0x00, 0x00, 0x00, 0x00, 0x00, 0x00.
0x00340: 0x01, 0x00, 0x00, 0x00, 0x00, 0x00, 0x00, 0x00, 0x00, 0x00, 0x00, 0x00, 0x00, 0x00, 0x00, 0x00.
0x00350: 0x00, 0x00, 0x00, 0x00, 0xFB, 0x01, 0x00, 0x00, 0x00, 0x00, 0x00, 0x00, 0x00, 0x00, 0x00, 0x00.
0x00380: 0x00, 0x00, 0x00, 0x00, 0x00, 0x00, 0x00, 0x00, 0x00, 0x00, 0x00, 0x00, 0x00, 0x00, 0x00, 0x00.
0x00400: 0x00, 0x22, 0xB9, 0x42, 0x61, 0x6C, 0x73, 0x61, 0x32, 0x00, 0xA7, 0x5E, 0x00, 0x00, 0x00, 0x00.
0x00600: 0x01, 0x00, 0x00, 0x00, 0x00, 0x00, 0x00, 0x00, 0x00, 0x00, 0x00, 0x00, 0x00, 0x00, 0x00, 0x00.
0x00700: 0x05, 0xB7, 0xFF, 0x00, 0x00, 0x00, 0x00, 0x00, 0x00, 0x00, 0x00, 0x00, 0x00, 0x00, 0x00, 0x00.
0x00720: 0x05, 0x04, 0x03, 0xFF, 0x0A, 0x04, 0x0A, 0x00, 0x1B, 0x00, 0x0D, 0x2F, 0x03, 0xFF, 0xFF, 0x03.
0x00730: 0x00, 0x00, 0x04, 0x10, 0x00, 0x00, 0x00, 0x00, 0x00, 0x00, 0x00, 0x00, 0x00, 0x00, 0x00, 0x00.
0x007A0: 0x00, 0x00, 0x00, 0x00, 0x00, 0x00, 0x00, 0x00, 0x00, 0x00, 0x00, 0x00, 0x00, 0x00, 0x00, 0x00.
0x02008: 0x02, 0x16, 0x29, 0x01, 0x77, 0x77, 0x01, 0x01, 0x00, 0x00, 0x00, 0x00, 0x00, 0x00, 0x00, 0x00.
0x02200: 0x14, 0x0A, 0xC4, 0x41, 0x00, 0x10, 0x01, 0xC0, 0x02, 0x00, 0x00, 0x00, 0x1F, 0x0B, 0x80, 0x00.
0x02210: 0x00, 0x00, 0x00, 0x00, 0x01, 0x00, 0x00, 0x00, 0x00, 0x00, 0x00, 0x00, 0x00, 0x00, 0x00, 0x00.
