0x00000: 0x14, 0x00, 0x44, 0xC1, 0x00, 0x00, 0x01, 0xC0, 0x02, 0x00, 0x02, 0x00, 0x00, 0x0B, 0x80, 0x00.
0x00010: 0xA4, 0x1F, 0x30, 0x2A, 0x76, 0x2F, 0xBC, 0x34, 0x48, 0x3F, 0x60, 0x54, 0x78, 0x69, 0x34, 0x9E.
0x00020: 0x00, 0x00, 0x00, 0x00, 0x00, 0x00, 0x00, 0x00, 0x00, 0x00, 0x00, 0x00, 0x00, 0x00, 0x03, 0x01.
0x00060: 0x00, 0x00, 0x00, 0x00, 0x00, 0x00, 0x00, 0x00, 0x00, 0x00, 0x00, 0x00, 0x00, 0x00, 0x00, 0x00.
0x00070: 0x03, 0x30, 0x0F, 0xA0, 0x04, 0x00, 0x00, 0x00, 0x00, 0x00, 0x00, 0x00, 0x00, 0x00, 0x00, 0x00.
0x00090: 0x00, 0x00, 0x00, 0x00, 0x00, 0x00, 0x00, 0x00, 0x00, 0x00, 0x00, 0x00, 0x00, 0x00, 0x00, 0x00.
0x00100: 0x1E, 0x04, 0x00, 0x00, 0x00, 0x00, 0x00, 0x80, 0x00, 0x00, 0x01, 0x00, 0x00, 0x00, 0x00, 0x00.
0x00110: 0x00, 0x00, 0x00, 0x00, 0x00, 0x06, 0x00, 0x00, 0x00, 0x00, 0x00, 0x00, 0x00, 0x00, 0x00, 0x00.
0x00160: 0x00, 0x00, 0x00, 0x00, 0x00, 0x00, 0x00, 0x00, 0x00, 0x00, 0x00, 0x00, 0x00, 0x00, 0x00, 0x00.
0x00170: 0x00, 0x00, 0x00, 0x00, 0x00, 0x00, 0x00, 0x00, 0x00, 0x00, 0x00, 0x00, 0x00, 0x00, 0x00, 0x00.
0x00200: 0x01, 0x00, 0x77, 0x77, 0x01, 0x01, 0x00, 0x00, 0x00, 0x00, 0x00, 0x00, 0x00, 0x00, 0x00, 0x00.
0x00210: 0x00, 0x00, 0x00, 0x00, 0x00, 0x00, 0x00, 0x00, 0x00, 0x0A, 0x00, 0x00, 0x00, 0x00, 0x00, 0x00.
0x00220: 0x00, 0x00, 0x00, 0x00, 0x00, 0x00, 0x00, 0x00, 0x00, 0x00, 0x00, 0x00, 0x00, 0x00, 0x00, 0x00.
0x00230: 0x00, 0x00, 0x00, 0x00, 0x00, 0x00, 0x00, 0x00, 0x00, 0x00, 0x00, 0x00, 0x00, 0x00, 0x00, 0x00.
0x00240: 0x00, 0x00, 0x00, 0x00, 0x00, 0x00, 0x20, 0x00, 0x00, 0x00, 0x00, 0x00, 0x00, 0x00, 0x00, 0x00.
0x00310: 0x00, 0x00, 0x00, 0x00, 0x06, 0x00, 0x00, 0x00, 0x00, 0x00, 0x00, 0x00, 0x00, 0x00, 0x00, 0x00.
0x00320: 0x01, 0x00, 0x00, 0x00, 0x00, 0x00, 0x00, 0x00, 0x00, 0x00, 0x00, 0x00, 0x00, 0x00, 0x00, 0x00.
0x00340: 0x01, 0xD7, 0x00, 0x00, 0xA0, 0x00, 0xDB, 0x05, 0x1F, 0x03, 0x00, 0x00, 0xF4, 0x01, 0x00, 0x00.
0x00350: 0x00, 0x00, 0x00, 0x00, 0xF4, 0x01, 0xF0, 0x00, 0x10, 0x00, 0x00, 0x00, 0x00, 0x00, 0x00, 0x00.
0x00380: 0x00, 0x00, 0x00, 0x00, 0x00, 0x00, 0x00, 0x00, 0x00, 0x00, 0x00, 0x00, 0x00, 0x00, 0x00, 0x00.
0x00400: 0x38, 0xEC, 0x11, 0x00, 0x00, 0x00, 0x00, 0x00, 0x00, 0x00, 0x01, 0xFD, 0x00, 0x00, 0x00, 0x00.
0x00600: 0x01, 0x00, 0x00, 0x00, 0x00, 0x00, 0x00, 0x00, 0x00, 0x00, 0x00, 0x00, 0x00, 0x00, 0x00, 0x00.
0x00700: 0x04, 0x9B, 0xA7, 0x04, 0x00, 0x00, 0x00, 0x00, 0x00, 0x00, 0x00, 0x00, 0x00, 0x00, 0x00, 0x00.
0x00720: 0x00, 0x0A, 0x00, 0xFF, 0x08, 0x08, 0x08, 0x00, 0x80, 0x00, 0x02, 0xA3, 0x00, 0xFF, 0xFF, 0x03.
0x00730: 0x00, 0x00, 0x08, 0x14, 0x00, 0x00, 0x00, 0x00, 0x00, 0x00, 0x00, 0x00, 0x00, 0x00, 0x00, 0x00.
0x007A0: 0x00, 0x00, 0x00, 0x00, 0x00, 0x00, 0x00, 0x00, 0x00, 0x00, 0x00, 0x00, 0x00, 0x00, 0x00, 0x00.
0x02008: 0x00, 0x01, 0x00, 0x00, 0x00, 0x00, 0x01, 0x01, 0x00, 0x00, 0x00, 0x00, 0x00, 0x00, 0x00, 0x00.
0x02200: 0x14, 0x00, 0x44, 0xC1, 0x00, 0x00, 0x01, 0xC0, 0x02, 0x00, 0x02, 0x00, 0x00, 0x0B, 0x80, 0x00.
0x02210: 0x08, 0x00, 0x00, 0x00, 0x00, 0x00, 0x00, 0x00, 0x00, 0x00, 0x00, 0x00, 0x00, 0x00, 0x00, 0x00.
